,version,id,key,name,title,blurb,tags,partype,info.attack,info.defense,info.magic,info.difficulty,image.full,image.sprite,image.group,image.x,image.y,image.w,image.h,stats.hp,stats.hpperlevel,stats.mp,stats.mpperlevel,stats.movespeed,stats.armor,stats.armorperlevel,stats.spellblock,stats.spellblockperlevel,stats.attackrange,stats.hpregen,stats.hpregenperlevel,stats.mpregen,stats.mpregenperlevel,stats.crit,stats.critperlevel,stats.attackdamage,stats.attackdamageperlevel,stats.attackspeedperlevel,stats.attackspeed
0,10.6.1,Kayle,10,Kayle,the Righteous,"Born to a Targonian Aspect at the height of the Rune Wars, Kayle honored her mother's legacy by fighting for justice on wings of divine flame. She and her twin sister Morgana were the protectors of Demacia for many years—until Kayle became disillusioned...","['Fighter', 'Support']",Mana,6,6,7,7,Kayle.png,champion1.png,champion,192,96,48,48,600.0,85,330.0,50.0,335,26.0,3.0,34.0,0.5,175,5.0,0.5,8.0,0.8,0,0,50.0,2.5,1.5,0.625
0,10.6.1,Kayn,141,Kayn,the Shadow Reaper,"A peerless practitioner of lethal shadow magic, Shieda Kayn battles to achieve his true destiny—to one day lead the Order of Shadow into a new era of Ionian supremacy. He wields the sentient darkin weapon Rhaast, undeterred by its creeping corruption of...","['Fighter', 'Assassin']",Mana,10,6,1,8,Kayn.png,champion1.png,champion,240,96,48,48,585.0,85,410.0,50.0,340,38.0,3.3,32.1,1.25,175,8.0,0.75,11.5,0.95,0,0,68.0,3.3,2.7,0.669
0,10.6.1,Kennen,85,Kennen,the Heart of the Tempest,"More than just the lightning-quick enforcer of Ionian balance, Kennen is the only yordle member of the Kinkou. Despite his small, furry stature, he is eager to take on any threat with a whirling storm of shuriken and boundless enthusiasm. Alongside his...","['Mage', 'Marksman']",Energy,6,4,7,4,Kennen.png,champion1.png,champion,288,96,48,48,541.0,84,200.0,0.0,335,29.0,3.75,30.0,0.5,550,5.5,0.65,50.0,0.0,0,0,48.0,3.75,3.4,0.625
0,10.6.1,Khazix,121,Kha'Zix,the Voidreaver,"The Void grows, and the Void adapts—in none of its myriad spawn are these truths more apparent than Kha'Zix. Evolution drives the core of this mutating horror, born to survive and to slay the strong. Where it struggles to do so, it grows new, more...",['Assassin'],Mana,9,4,3,6,Khazix.png,champion1.png,champion,336,96,48,48,572.8,85,327.2,40.0,350,36.0,3.0,32.1,1.25,125,7.5,0.75,7.59,0.5,0,0,63.0,3.1,2.7,0.668
0,10.6.1,Kindred,203,Kindred,The Eternal Hunters,"Separate, but never parted, Kindred represents the twin essences of death. Lamb's bow offers a swift release from the mortal realm for those who accept their fate. Wolf hunts down those who run from their end, delivering violent finality within his...",['Marksman'],Mana,8,2,2,4,Kindred.png,champion1.png,champion,384,96,48,48,540.0,85,300.0,35.0,325,29.0,3.5,30.0,0.5,500,7.0,0.55,7.0,0.4,0,0,65.0,2.5,3.5,0.625
0,10.6.1,Kled,240,Kled,the Cantankerous Cavalier,"A warrior as fearless as he is ornery, the yordle Kled embodies the furious bravado of Noxus. He is an icon beloved by the empire's soldiers, distrusted by its officers, and loathed by the nobility. Many claim Kled has fought in every campaign the...","['Fighter', 'Tank']",Courage,8,2,2,7,Kled.png,champion1.png,champion,432,96,48,48,340.0,70,100.0,0.0,345,35.0,4.0,32.1,1.25,125,6.0,0.75,0.0,0.0,0,0,65.0,3.5,3.5,0.625
0,10.6.1,KogMaw,96,Kog'Maw,the Mouth of the Abyss,"Belched forth from a rotting Void incursion deep in the wastelands of Icathia, Kog'Maw is an inquisitive yet putrid creature with a caustic, gaping mouth. This particular Void-spawn needs to gnaw and drool on anything within reach to truly understand it...","['Marksman', 'Mage']",Mana,8,2,5,6,KogMaw.png,champion2.png,champion,0,0,48,48,534.0,88,325.0,40.0,330,24.0,3.5,30.0,0.5,500,3.75,0.55,8.75,0.7,0,0,61.0,3.11,2.65,0.665
0,10.6.1,Leblanc,7,LeBlanc,the Deceiver,"Mysterious even to other members of the Black Rose cabal, LeBlanc is but one of many names for a pale woman who has manipulated people and events since the earliest days of Noxus. Using her magic to mirror herself, the sorceress can appear to anyone...","['Assassin', 'Mage']",Mana,1,4,10,9,Leblanc.png,champion2.png,champion,48,0,48,48,528.0,92,334.0,50.0,340,21.88,3.5,30.0,0.5,525,7.5,0.55,6.0,0.8,0,0,54.88,3.5,1.4,0.625
0,10.6.1,LeeSin,64,Lee Sin,the Blind Monk,"A master of Ionia's ancient martial arts, Lee Sin is a principled fighter who channels the essence of the dragon spirit to face any challenge. Though he lost his sight many years ago, the warrior-monk has devoted his life to protecting his homeland...","['Fighter', 'Assassin']",Energy,8,5,3,6,LeeSin.png,champion2.png,champion,96,0,48,48,575.0,85,200.0,0.0,345,33.0,3.7,32.1,1.25,125,7.5,0.7,50.0,0.0,0,0,70.0,3.2,3.0,0.651
0,10.6.1,Leona,89,Leona,the Radiant Dawn,"Imbued with the fire of the sun, Leona is a holy warrior of the Solari who defends Mount Targon with her Zenith Blade and the Shield of Daybreak. Her skin shimmers with starfire while her eyes burn with the power of the celestial Aspect within her...","['Tank', 'Support']",Mana,4,8,3,4,Leona.png,champion2.png,champion,144,0,48,48,576.16,87,302.2,40.0,335,47.0,3.6,32.1,1.25,125,8.5,0.85,6.0,0.8,0,0,60.04,3.0,2.9,0.625
0,10.6.1,Lissandra,127,Lissandra,the Ice Witch,"Lissandra's magic twists the pure power of ice into something dark and terrible. With the force of her black ice, she does more than freeze—she impales and crushes those who oppose her. To the terrified denizens of the north, she is known only as ''The...",['Mage'],Mana,2,5,8,6,Lissandra.png,champion2.png,champion,192,0,48,48,550.0,90,475.0,30.0,325,22.0,3.7,30.0,0.5,550,7.0,0.55,8.0,0.4,0,0,53.0,2.7,1.36,0.656
0,10.6.1,Lucian,236,Lucian,the Purifier,"Lucian, a Sentinel of Light, is a grim hunter of undying spirits, pursuing them relentlessly and annihilating them with his twin relic pistols. After the wraith Thresh slew his wife, Lucian embarked on the path of vengeance—but even with her return to...",['Marksman'],Mana,8,5,3,6,Lucian.png,champion2.png,champion,240,0,48,48,571.0,86,348.88,38.0,335,28.0,3.0,30.0,0.5,500,3.75,0.65,8.176,0.7,0,0,64.0,2.75,3.3,0.638
0,10.6.1,Lulu,117,Lulu,the Fae Sorceress,"The yordle mage Lulu is known for conjuring dreamlike illusions and fanciful creatures as she roams Runeterra with her fairy companion Pix. Lulu shapes reality on a whim, warping the fabric of the world, and what she views as the constraints of this...","['Support', 'Mage']",Mana,4,5,7,5,Lulu.png,champion2.png,champion,288,0,48,48,525.0,74,350.0,55.0,330,29.0,3.7,30.0,0.5,550,6.0,0.6,11.0,0.6,0,0,47.0,2.6,2.25,0.625
0,10.6.1,Lux,99,Lux,the Lady of Luminosity,"Luxanna Crownguard hails from Demacia, an insular realm where magical abilities are viewed with fear and suspicion. Able to bend light to her will, she grew up dreading discovery and exile, and was forced to keep her power secret, in order to preserve...","['Mage', 'Support']",Mana,2,4,9,5,Lux.png,champion2.png,champion,336,0,48,48,490.0,85,480.0,23.5,330,18.72,4.0,30.0,0.5,550,5.5,0.55,8.0,0.8,0,0,53.54,3.3,1.0,0.669
0,10.6.1,Malphite,54,Malphite,Shard of the Monolith,"A massive creature of living stone, Malphite struggles to impose blessed order on a chaotic world. Birthed as a servitor-shard to an otherworldly obelisk known as the Monolith, he used his tremendous elemental strength to maintain and protect his...","['Tank', 'Fighter']",Mana,5,9,7,2,Malphite.png,champion2.png,champion,384,0,48,48,574.2,90,282.2,40.0,335,37.0,3.75,32.1,1.25,125,7.0,0.55,7.324,0.55,0,0,61.97,4.0,3.4,0.736
0,10.6.1,Malzahar,90,Malzahar,the Prophet of the Void,"A zealous seer dedicated to the unification of all life, Malzahar truly believes the newly emergent Void to be the path to Runeterra's salvation. In the desert wastes of Shurima, he followed the voices that whispered in his mind, all the way to ancient...","['Mage', 'Assassin']",Mana,2,2,9,6,Malzahar.png,champion2.png,champion,432,0,48,48,537.0,87,375.0,27.5,335,18.0,3.5,30.0,0.5,500,6.0,0.6,8.0,0.8,0,0,55.0,3.0,1.5,0.625
0,10.6.1,Maokai,57,Maokai,the Twisted Treant,"Maokai is a rageful, towering treant who fights the unnatural horrors of the Shadow Isles. He was twisted into a force of vengeance after a magical cataclysm destroyed his home, surviving undeath only through the Waters of Life infused within his...","['Tank', 'Mage']",Mana,3,8,6,3,Maokai.png,champion2.png,champion,0,48,48,48,565.0,95,377.28,43.0,335,39.0,4.0,32.1,1.25,125,5.0,0.75,7.2,0.6,0,0,63.54,3.3,2.125,0.8
0,10.6.1,MasterYi,11,Master Yi,the Wuju Bladesman,"Master Yi has tempered his body and sharpened his mind, so that thought and action have become almost as one. Though he chooses to enter into violence only as a last resort, the grace and speed of his blade ensures resolution is always swift. As one of...","['Assassin', 'Fighter']",Mana,10,4,2,4,MasterYi.png,champion2.png,champion,48,48,48,48,598.56,92,250.56,42.0,355,33.0,3.0,32.1,1.25,125,7.5,0.65,7.256,0.45,0,0,66.0,3.0,2.0,0.679
0,10.6.1,MissFortune,21,Miss Fortune,the Bounty Hunter,"A Bilgewater captain famed for her looks but feared for her ruthlessness, Sarah Fortune paints a stark figure among the hardened criminals of the port city. As a child, she witnessed the reaver king Gangplank murder her family—an act she brutally...",['Marksman'],Mana,8,2,5,1,MissFortune.png,champion2.png,champion,96,48,48,48,541.0,91,325.84,35.0,325,28.0,3.0,30.0,0.5,550,3.75,0.65,8.042,0.65,0,0,50.0,2.7,2.25,0.656
0,10.6.1,MonkeyKing,62,Wukong,the Monkey King,"Wukong is a vastayan trickster who uses his strength, agility, and intelligence to confuse his opponents and gain the upper hand. After finding a lifelong friend in the warrior known as Master Yi, Wukong became the last student of the ancient martial...","['Fighter', 'Tank']",Mana,8,5,2,3,MonkeyKing.png,champion2.png,champion,144,48,48,48,540.0,85,300.0,45.0,345,34.0,3.5,28.0,1.25,175,5.0,0.65,8.0,0.65,0,0,68.0,4.0,3.0,0.711
0,10.6.1,Mordekaiser,82,Mordekaiser,the Iron Revenant,"Twice slain and thrice born, Mordekaiser is a brutal warlord from a foregone epoch who uses his necromantic sorcery to bind souls into an eternity of servitude. Few now remain who remember his earlier conquests, or know the true extent of his powers—but...",['Fighter'],Shield,4,6,7,4,Mordekaiser.png,champion2.png,champion,192,48,48,48,575.0,90,100.0,0.0,335,37.0,3.0,32.0,1.25,175,5.0,0.75,0.0,0.0,0,0,61.0,4.0,1.0,0.625
0,10.6.1,Morgana,25,Morgana,the Fallen,"Conflicted between her celestial and mortal natures, Morgana bound her wings to embrace humanity, and inflicts her pain and bitterness upon the dishonest and the corrupt. She rejects laws and traditions she believes are unjust, and fights for truth from...","['Mage', 'Support']",Mana,1,6,8,1,Morgana.png,champion2.png,champion,240,48,48,48,560.0,90,340.0,60.0,335,25.0,3.8,30.0,0.5,450,5.5,0.4,11.0,0.4,0,0,56.0,3.5,1.53,0.625
0,10.6.1,Nami,267,Nami,the Tidecaller,"A headstrong young vastaya of the seas, Nami was the first of the Marai tribe to leave the waves and venture onto dry land, when their ancient accord with the Targonians was broken. With no other option, she took it upon herself to complete the sacred...","['Support', 'Mage']",Mana,4,3,7,5,Nami.png,champion2.png,champion,288,48,48,48,489.32,74,377.24,43.0,335,29.0,4.0,30.0,0.5,550,5.5,0.55,11.5,0.4,0,0,51.208,3.1,2.61,0.644
0,10.6.1,Nasus,75,Nasus,the Curator of the Sands,"Nasus is an imposing, jackal-headed Ascended being from ancient Shurima, a heroic figure regarded as a demigod by the people of the desert. Fiercely intelligent, he was a guardian of knowledge and peerless strategist whose wisdom guided the ancient...","['Fighter', 'Tank']",Mana,7,5,6,6,Nasus.png,champion2.png,champion,336,48,48,48,561.2,90,325.6,42.0,350,34.0,3.5,32.1,1.25,125,9.0,0.9,7.44,0.5,0,0,67.0,3.5,3.48,0.638
0,10.6.1,Nautilus,111,Nautilus,the Titan of the Depths,"A lonely legend as old as the first piers sunk in Bilgewater, the armored goliath known as Nautilus roams the dark waters off the coast of the Blue Flame Isles. Driven by a forgotten betrayal, he strikes without warning, swinging his enormous anchor to...","['Tank', 'Fighter']",Mana,4,6,6,6,Nautilus.png,champion2.png,champion,384,48,48,48,576.48,86,400.0,47.0,325,39.0,3.75,32.1,1.25,175,8.5,0.55,8.626,0.5,0,0,61.0,3.3,1.0,0.706
0,10.6.1,Neeko,518,Neeko,the Curious Chameleon,"Hailing from a long lost tribe of vastaya, Neeko can blend into any crowd by borrowing the appearances of others, even absorbing something of their emotional state to tell friend from foe in an instant. No one is ever sure where—or who—Neeko might be...","['Mage', 'Support']",Mana,1,1,9,5,Neeko.png,champion2.png,champion,432,48,48,48,540.0,90,450.0,30.0,340,21.0,4.0,30.0,0.5,550,7.5,0.75,7.0,0.7,0,0,48.0,2.5,3.5,0.625
0,10.6.1,Nidalee,76,Nidalee,the Bestial Huntress,"Raised in the deepest jungle, Nidalee is a master tracker who can shapeshift into a ferocious cougar at will. Neither wholly woman nor beast, she viciously defends her territory from any and all trespassers, with carefully placed traps and deft spear...","['Assassin', 'Mage']",Mana,5,4,7,8,Nidalee.png,champion2.png,champion,0,96,48,48,545.0,85,295.6,45.0,335,28.0,3.5,30.0,0.5,525,6.0,0.6,6.0,0.8,0,0,61.0,3.5,3.22,0.638
0,10.6.1,Nocturne,56,Nocturne,the Eternal Nightmare,"A demonic amalgamation drawn from the nightmares that haunt every sentient mind, the thing known as Nocturne has become a primordial force of pure evil. It is liquidly chaotic in aspect, a faceless shadow with cold eyes and armed with wicked-looking...","['Assassin', 'Fighter']",Mana,9,5,2,4,Nocturne.png,champion2.png,champion,48,96,48,48,585.0,85,275.0,35.0,345,38.0,3.5,32.1,1.25,125,8.5,0.75,7.0,0.45,0,0,62.0,3.1,2.7,0.721
0,10.6.1,Nunu,20,Nunu & Willump,the Boy and His Yeti,"Once upon a time, there was a boy who wanted to prove he was a hero by slaying a fearsome monster—only to discover that the beast, a lonely and magical yeti, merely needed a friend. Bound together by ancient power and a shared love of snowballs, Nunu...","['Tank', 'Fighter']",Mana,4,6,7,4,Nunu.png,champion2.png,champion,96,96,48,48,570.0,82,280.0,42.0,345,32.0,3.0,32.1,1.25,125,5.0,0.8,7.0,0.5,0,0,61.0,3.0,2.25,0.625
0,10.6.1,Olaf,2,Olaf,the Berserker,"An unstoppable force of destruction, the axe-wielding Olaf wants nothing but to die in glorious combat. Hailing from the brutal Freljordian peninsula of Lokfar, he once received a prophecy foretelling his peaceful passing—a coward's fate, and a great...","['Fighter', 'Tank']",Mana,9,5,3,3,Olaf.png,champion2.png,champion,144,96,48,48,597.24,93,315.6,42.0,350,35.0,3.0,32.1,1.25,125,8.5,0.9,7.466,0.575,0,0,68.0,3.5,2.7,0.694
0,10.6.1,Orianna,61,Orianna,the Lady of Clockwork,"Once a curious girl of flesh and blood, Orianna is now a technological marvel comprised entirely of clockwork. She became gravely ill after an accident in the lower districts of Zaun, and her failing body had to be replaced with exquisite artifice...","['Mage', 'Support']",Mana,4,3,9,7,Orianna.png,champion2.png,champion,192,96,48,48,530.0,91,418.0,25.0,325,17.04,3.0,26.0,0.5,525,7.0,0.55,8.0,0.8,0,0,40.368,2.6,3.5,0.658
0,10.6.1,Ornn,516,Ornn,The Fire below the Mountain,"Ornn is the Freljordian spirit of forging and craftsmanship. He works in the solitude of a massive smithy, hammered out from the lava caverns beneath the volcano Hearth-Home. There he stokes bubbling cauldrons of molten rock to purify ores and fashion...","['Tank', 'Fighter']",Mana,5,9,3,5,Ornn.png,champion2.png,champion,240,96,48,48,590.0,95,340.6,45.0,335,36.0,4.0,32.1,1.25,175,9.0,0.9,8.01,0.6,0,0,69.0,3.5,2.0,0.625
0,10.6.1,Pantheon,80,Pantheon,the Unbreakable Spear,"Once an unwilling host to the Aspect of War, Atreus survived when the celestial power within him was slain, refusing to succumb to a blow that tore stars from the heavens. In time, he learned to embrace the power of his own mortality, and the stubborn...","['Fighter', 'Assassin']",Mana,9,4,3,4,Pantheon.png,champion2.png,champion,288,96,48,48,580.0,95,317.12,31.0,355,40.0,3.75,28.0,1.25,175,10.0,0.65,7.356,0.45,0,0,64.0,3.3,2.95,0.644
0,10.6.1,Poppy,78,Poppy,Keeper of the Hammer,"Runeterra has no shortage of valiant champions, but few are as tenacious as Poppy. Bearing the legendary hammer of Orlon, a weapon twice her size, this determined yordle has spent untold years searching in secret for the fabled “Hero of Demacia,” said...","['Tank', 'Fighter']",Mana,6,7,2,6,Poppy.png,champion2.png,champion,336,96,48,48,540.0,90,280.0,40.0,345,38.0,3.5,32.0,1.25,125,8.0,0.8,7.0,0.7,0,0,64.0,4.0,2.5,0.625
0,10.6.1,Pyke,555,Pyke,the Bloodharbor Ripper,"A renowned harpooner from the slaughter docks of Bilgewater, Pyke should have met his death in the belly of a gigantic jaull-fish… and yet, he returned. Now, stalking the dank alleys and backways of his former hometown, he uses his new supernatural...","['Support', 'Assassin']",Mana,9,3,1,7,Pyke.png,champion2.png,champion,384,96,48,48,600.0,90,415.0,50.0,330,45.0,5.0,32.0,1.5,150,7.0,0.5,8.0,1.0,0,0,62.0,2.0,2.5,0.667
0,10.6.1,Qiyana,246,Qiyana,Empress of the Elements,"In the jungle city of Ixaocan, Qiyana plots her own ruthless path to the high seat of the Yun Tal. Last in line to succeed her parents, she faces those who stand in her way with brash confidence and unprecedented mastery over elemental magic. With the...","['Assassin', 'Fighter']",Mana,0,2,4,8,Qiyana.png,champion2.png,champion,432,96,48,48,590.0,90,320.0,50.0,335,28.0,3.5,32.1,1.25,150,8.5,0.65,8.0,0.7,0,0,64.0,3.1,2.1,0.625
0,10.6.1,Quinn,133,Quinn,Demacia's Wings,"Quinn is an elite ranger-knight of Demacia, who undertakes dangerous missions deep in enemy territory. She and her legendary eagle, Valor, share an unbreakable bond, and their foes are often slain before they realize they are fighting not one, but two...","['Marksman', 'Assassin']",Mana,9,4,2,5,Quinn.png,champion3.png,champion,0,0,48,48,532.8,85,268.8,35.0,335,28.0,3.5,30.0,0.5,525,5.5,0.55,6.972,0.4,0,0,59.0,2.4,3.1,0.668
0,10.6.1,Rakan,497,Rakan,The Charmer,"As mercurial as he is charming, Rakan is an infamous vastayan troublemaker and the greatest battle-dancer in Lhotlan tribal history. To the humans of the Ionian highlands, his name has long been synonymous with wild festivals, uncontrollable parties...",['Support'],Mana,2,4,8,5,Rakan.png,champion3.png,champion,48,0,48,48,540.0,85,315.0,50.0,335,32.0,3.9,32.1,1.25,300,5.0,0.5,8.75,0.5,0,0,62.0,3.5,3.0,0.635
0,10.6.1,Rammus,33,Rammus,the Armordillo,"Idolized by many, dismissed by some, mystifying to all, the curious being Rammus is an enigma. Protected by a spiked shell, he inspires increasingly disparate theories on his origin wherever he goes—from demigod, to sacred oracle, to a mere beast...","['Tank', 'Fighter']",Mana,4,10,5,5,Rammus.png,champion3.png,champion,96,0,48,48,564.48,95,310.44,33.0,335,36.0,4.3,32.1,1.25,125,8.0,0.55,7.84,0.5,0,0,55.88,3.5,2.215,0.656
0,10.6.1,RekSai,421,Rek'Sai,the Void Burrower,"An apex predator, Rek'Sai is a merciless Void-spawn that tunnels beneath the ground to ambush and devour unsuspecting prey. Her insatiable hunger has laid waste to entire regions of the once-great empire of Shurima—merchants, traders, even armed...",['Fighter'],Rage,8,5,2,3,RekSai.png,champion3.png,champion,144,0,48,48,570.0,85,100.0,0.0,335,36.0,3.75,32.1,1.25,175,7.5,0.65,0.0,0.0,0,0,64.0,3.0,2.0,0.667
0,10.6.1,Renekton,58,Renekton,the Butcher of the Sands,"Renekton is a terrifying, rage-fueled Ascended being from the scorched deserts of Shurima. Once, he was his empire's most esteemed warrior, leading the nation's armies to countless victories. However, after the empire's fall, Renekton was entombed...","['Fighter', 'Tank']",Fury,8,5,2,3,Renekton.png,champion3.png,champion,192,0,48,48,575.0,87,100.0,0.0,345,35.0,4.0,32.1,1.25,125,8.0,0.75,0.0,0.0,0,0,69.0,3.75,2.75,0.665
0,10.6.1,Rengar,107,Rengar,the Pridestalker,"Rengar is a ferocious vastayan trophy hunter who lives for the thrill of tracking down and killing dangerous creatures. He scours the world for the most fearsome beasts he can find, especially seeking any trace of Kha'Zix, the void creature who...","['Assassin', 'Fighter']",Ferocity,7,4,2,8,Rengar.png,champion3.png,champion,240,0,48,48,585.0,90,4.0,0.0,345,34.0,3.0,32.1,1.25,125,7.0,0.5,0.0,0.0,0,0,68.0,3.0,3.0,0.667
0,10.6.1,Riven,92,Riven,the Exile,"Once a swordmaster in the warhosts of Noxus, Riven is an expatriate in a land she previously tried to conquer. She rose through the ranks on the strength of her conviction and brutal efficiency, and was rewarded with a legendary runic blade and a...","['Fighter', 'Assassin']",None,8,5,1,8,Riven.png,champion3.png,champion,288,0,48,48,558.48,86,0.0,0.0,340,33.0,3.2,32.1,1.25,125,7.0,0.5,0.0,0.0,0,0,64.0,3.0,3.5,0.625
0,10.6.1,Rumble,68,Rumble,the Mechanized Menace,"Rumble is a young inventor with a temper. Using nothing more than his own two hands and a heap of scrap, the feisty yordle constructed a colossal mech suit outfitted with an arsenal of electrified harpoons and incendiary rockets. Though others may scoff...","['Fighter', 'Mage']",Heat,3,6,8,10,Rumble.png,champion3.png,champion,336,0,48,48,589.0,85,100.0,0.0,345,31.0,3.5,32.1,1.25,125,8.0,0.6,0.0,0.0,0,0,61.0,3.2,1.85,0.644
0,10.6.1,Ryze,13,Ryze,the Rune Mage,"Widely considered one of the most adept sorcerers on Runeterra, Ryze is an ancient, hard-bitten archmage with an impossibly heavy burden to bear. Armed with immense arcane power and a boundless constitution, he tirelessly hunts for World Runes—fragments...","['Mage', 'Fighter']",Mana,2,2,10,7,Ryze.png,champion3.png,champion,384,0,48,48,570.48,98,300.0,50.0,340,21.552,3.0,34.0,0.5,550,8.0,0.8,8.0,1.0,0,0,55.04,3.0,2.112,0.625
0,10.6.1,Sejuani,113,Sejuani,Fury of the North,"Sejuani is the brutal, unforgiving Iceborn warmother of the Winter's Claw, one of the most feared tribes of the Freljord. Her people's survival is a constant, desperate battle against the elements, forcing them to raid Noxians, Demacians, and Avarosans...","['Tank', 'Fighter']",Mana,5,7,6,4,Sejuani.png,champion3.png,champion,432,0,48,48,560.0,100,400.0,40.0,340,34.0,4.25,32.1,1.25,150,8.5,1.0,7.0,0.7,0,0,66.0,4.0,3.5,0.688
0,10.6.1,Senna,235,Senna,the Redeemer,"Cursed from childhood to be haunted by the supernatural Black Mist, Senna joined a sacred order known as the Sentinels of Light, and fiercely fought back—only to be killed, her soul imprisoned in a lantern by the cruel wraith Thresh. But refusing to...","['Marksman', 'Support']",Mana,7,2,6,7,Senna.png,champion3.png,champion,0,48,48,48,520.0,75,350.0,45.0,330,28.0,3.5,30.0,0.5,600,3.5,0.55,11.5,0.4,0,0,50.0,0.0,4.0,0.625
0,10.6.1,Sett,875,Sett,the Boss,"A leader of Ionia's growing criminal underworld, Sett rose to prominence in the wake of the war with Noxus. Though he began as a humble challenger in the fighting pits of Navori, he quickly gained notoriety for his savage strength, and his ability to...","['Fighter', 'Tank']",Grit,8,5,1,2,Sett.png,champion3.png,champion,48,48,48,48,600.0,93,0.0,0.0,340,33.0,4.0,32.0,1.25,125,7.0,0.5,0.0,0.0,0,0,60.0,4.0,1.75,0.625
0,10.6.1,Shaco,35,Shaco,the Demon Jester,"Crafted long ago as a plaything for a lonely prince, the enchanted marionette Shaco now delights in murder and mayhem. Corrupted by dark magic and the loss of his beloved charge, the once-kind puppet finds pleasure only in the misery of the poor souls...",['Assassin'],Mana,8,4,6,9,Shaco.png,champion3.png,champion,96,48,48,48,587.0,89,297.2,40.0,350,30.0,3.5,32.1,1.25,125,8.5,0.55,7.156,0.45,0,0,63.0,3.0,3.0,0.694
0,10.6.1,Shen,98,Shen,the Eye of Twilight,"Among the secretive, Ionian warriors known as the Kinkou, Shen serves as their leader, the Eye of Twilight. He longs to remain free from the confusion of emotion, prejudice, and ego, and walks the unseen path of dispassionate judgment between the spirit...",['Tank'],Energy,3,9,3,4,Shen.png,champion3.png,champion,144,48,48,48,540.0,85,400.0,0.0,340,34.0,3.0,32.1,1.25,125,8.5,0.75,50.0,0.0,0,0,60.0,3.0,3.0,0.751
0,10.6.1,Shyvana,102,Shyvana,the Half-Dragon,"Shyvana is a creature with the magic of a rune shard burning within her heart. Though she often appears humanoid, she can take her true form as a fearsome dragon, incinerating her foes with fiery breath. Having saved the life of the crown prince Jarvan...","['Fighter', 'Tank']",Fury,8,6,3,4,Shyvana.png,champion3.png,champion,192,48,48,48,595.0,95,100.0,0.0,350,38.0,3.35,32.1,1.25,125,8.5,0.8,0.0,0.0,0,0,66.0,3.4,2.5,0.658
0,10.6.1,Singed,27,Singed,the Mad Chemist,"Singed is a Zaunite alchemist of unmatched intellect, who has devoted his life to pushing the boundaries of knowledge—with no price, even his own sanity, too high to pay. Is there a method to his madness? His concoctions rarely fail, but it appears to...","['Tank', 'Fighter']",Mana,4,8,7,5,Singed.png,champion3.png,champion,240,48,48,48,580.0,85,330.0,45.0,345,34.0,3.5,32.1,1.25,125,9.5,0.55,7.5,0.55,0,0,63.0,3.375,1.9,0.613
0,10.6.1,Sion,14,Sion,The Undead Juggernaut,"A war hero from a bygone era, Sion was revered in Noxus for choking the life out of a Demacian king with his bare hands—but, denied oblivion, he was resurrected to serve his empire even in death. His indiscriminate slaughter claimed all who stood in his...","['Tank', 'Fighter']",Mana,5,9,3,5,Sion.png,champion3.png,champion,288,48,48,48,545.0,73,330.0,42.0,345,32.0,3.0,32.1,1.25,175,7.5,0.8,8.0,0.6,0,0,68.0,4.0,1.3,0.679
0,10.6.1,Sivir,15,Sivir,the Battle Mistress,"Sivir is a renowned fortune hunter and mercenary captain who plies her trade in the deserts of Shurima. Armed with her legendary jeweled crossblade, she has fought and won countless battles for those who can afford her exorbitant price. Known for her...",['Marksman'],Mana,9,3,1,4,Sivir.png,champion3.png,champion,336,48,48,48,532.0,88,284.0,50.0,335,26.0,3.25,30.0,0.5,500,3.25,0.55,8.0,0.9,0,0,63.0,3.0,1.6,0.625
